[
  {
    "retention_terminal_compliance_report_closeout_record_id": "retention-terminal-compliance-report-closeout-basic-restore-001",
    "closeout_kind": "retention_terminal_compliance_report_closeout",
    "created_time": "2026-01-01T00:06:40Z",
    "node_id": "formal-rollup-node-example",
    "retention_terminal_compliance_report_verification_receipt_id": "retention-terminal-compliance-report-verification-basic-restore-001",
    "retention_terminal_compliance_report_record_id": "retention-terminal-compliance-report-basic-restore-001",
    "closeout_state": "closed",
    "outcome": "retention_terminal_compliance_report_verified_and_closed",
    "closed_refs": [
      "retention-terminal-compliance-report-verification-basic-restore-001",
      "retention-terminal-compliance-report-basic-restore-001",
      "retention-publication-terminal-status-basic-restore-001",
      "retention/retention-policy.json"
    ],
    "subject_refs": [
      "archive-lifecycle-closeout-basic-restore-001",
      "archive-lifecycle-verification-basic-restore-001",
      "archive-lifecycle-basic-restore-001",
      "archive-index-closeout-basic-restore-001"
    ],
    "basis_refs": [
      "retention-terminal-compliance-report-verification-basic-restore-001",
      "retention-terminal-compliance-report-basic-restore-001",
      "retention/retention-policy.json"
    ],
    "closed_by_ref": "tools/pfem_retention_terminal_compliance_report_closeout_records.py",
    "summary": "Synthetic example retention terminal compliance report closeout record showing workflow was closed after verification."
  }
]
